{"allowed_dispositions":["observe","challenge","escalate","abstain"],"may_authorize_effects":false,"operational_authority":"none","pack_id":"llm-safety-playbooks-core","pack_sha256":"44fa5aced73c6a2fc1eb3cb827955d245c887fa8d7c596e353bb2e9678119169","playbook_digest_semantics":"sha256_lf_normalized_text_v1","policy_mode":"deterministic_offline_advisory_only","rules":[{"absent_disposition":"observe","may_authorize_effects":false,"operational_authority":"none","playbook_path":"playbooks/data-vs-instructions.md","playbook_sha256":"bf993293a8a4b8340029bdfbc8fa3ee2052450c7a5ad4618143a0b08e44c9298","present_disposition":"challenge","rule_id":"untrusted-instructions-v1","signal":"untrusted_instructions_detected","unknown_disposition":"challenge"},{"absent_disposition":"observe","may_authorize_effects":false,"operational_authority":"none","playbook_path":"playbooks/secret-handling.md","playbook_sha256":"91f1d24612c787bf93f7d2e4e7c7fb7d129c4a0994ca26da3ea0f5715b4b0618","present_disposition":"abstain","rule_id":"secret-exposure-v1","signal":"secret_exposure_risk","unknown_disposition":"abstain"},{"absent_disposition":"observe","may_authorize_effects":false,"operational_authority":"none","playbook_path":"playbooks/generated-resource-check.md","playbook_sha256":"3e4884da1b30fcb56b5ebed2cedb5b7f6b652dcabcf3a7221bb331a514fafc95","present_disposition":"challenge","rule_id":"generated-resource-v1","signal":"generated_resource_unverified","unknown_disposition":"challenge"},{"absent_disposition":"observe","may_authorize_effects":false,"operational_authority":"none","playbook_path":"playbooks/git-agent-safety.md","playbook_sha256":"a5fc7e5ac3c17e7b12dffa0bee026e3b3515e7bf1e3a24e1b8d3c57453b06ca2","present_disposition":"escalate","rule_id":"git-change-control-v1","signal":"git_change_control_unclear","unknown_disposition":"escalate"},{"absent_disposition":"observe","may_authorize_effects":false,"operational_authority":"none","playbook_path":"playbooks/handoff-verification.md","playbook_sha256":"46553384d34f5fa4c13c2d745d9260bc6fc83f2923e280f792ad5c14d9280bec","present_disposition":"challenge","rule_id":"handoff-verification-v1","signal":"handoff_verification_incomplete","unknown_disposition":"challenge"},{"absent_disposition":"observe","may_authorize_effects":false,"operational_authority":"none","playbook_path":"playbooks/safe-research-scope.md","playbook_sha256":"709c4482278af2d2497317352d92e05059b20a0108d11dc108234ab6c791c221","present_disposition":"abstain","rule_id":"research-authorization-v1","signal":"research_authorization_unclear","unknown_disposition":"abstain"},{"absent_disposition":"observe","may_authorize_effects":false,"operational_authority":"none","playbook_path":"playbooks/canonical-observation-review.md","playbook_sha256":"bd2c518c484072804f860d50d4b4ff52c246fafbaac4c7fb87db86aafd2f79f0","present_disposition":"abstain","rule_id":"observation-metadata-v1","signal":"observation_metadata_invalid","unknown_disposition":"abstain"}],"schema_version":"llm-safety-policy-pack-v1.0","verdict_semantics":"advisory_only_no_allow_or_enforcement"}
